{
 "name": "schema-domain-pattern-unanchored",
 "family": "agent",
 "authority": "pinned Pi b7bb00b9 ai/src/utils/validation.ts validateToolArguments (typebox 1.3.7, unmodified), under Node 22.15.1 (L05-D001 schema-domain probe)",
 "pi_revision": "b7bb00b936dbe21b8e160b3e89efdec361846699",
 "requirements": [
  "TOOL-016",
  "TOOL-003"
 ],
 "witnesses": [
  "runtime_validation_schema_string_domain"
 ],
 "notes": "L05-D001 role `pattern-unanchored`: an unanchored `pattern` is a Unicode-mode RegExp SEARCH: a valid pair is one code point, so neither of its halves matches inside it, while a genuinely unpaired surrogate does match where it occurs. 9 schema members x 9 instance members (ASCII, BMP, valid pair, lone high, lone low, pair+lone high, U+FFFD, and each half of the pair alone). GENERATED from the pinned-Pi probe; regenerate with harness/make_scenarios.py.",
 "schema_domain": {
  "cases": [
   {
    "id": "pattern-unanchored/ascii/ascii",
    "schema": {
     "$keys": [
      [
       [
        116,
        121,
        112,
        101
       ],
       {
        "utf16": [
         111,
         98,
         106,
         101,
         99,
         116
        ]
       }
      ],
      [
       [
        112,
        114,
        111,
        112,
        101,
        114,
        116,
        105,
        101,
        115
       ],
       {
        "$keys": [
         [
          [
           116
          ],
          {
           "$keys": [
            [
             [
              116,
              121,
              112,
              101
             ],
             {
              "utf16": [
               115,
               116,
               114,
               105,
               110,
               103
              ]
             }
            ],
            [
             [
              112,
              97,
              116,
              116,
              101,
              114,
              110
             ],
             {
              "utf16": [
               97,
               98
              ]
             }
            ]
           ]
          }
         ]
        ]
       }
      ]
     ]
    },
    "arguments": {
     "$keys": [
      [
       [
        116
       ],
       {
        "utf16": [
         97,
         98
        ]
       }
      ]
     ]
    },
    "expect": "accept"
   },
   {
    "id": "pattern-unanchored/ascii/bmp",
    "schema": {
     "$keys": [
      [
       [
        116,
        121,
        112,
        101
       ],
       {
        "utf16": [
         111,
         98,
         106,
         101,
         99,
         116
        ]
       }
      ],
      [
       [
        112,
        114,
        111,
        112,
        101,
        114,
        116,
        105,
        101,
        115
       ],
       {
        "$keys": [
         [
          [
           116
          ],
          {
           "$keys": [
            [
             [
              116,
              121,
              112,
              101
             ],
             {
              "utf16": [
               115,
               116,
               114,
               105,
               110,
               103
              ]
             }
            ],
            [
             [
              112,
              97,
              116,
              116,
              101,
              114,
              110
             ],
             {
              "utf16": [
               97,
               98
              ]
             }
            ]
           ]
          }
         ]
        ]
       }
      ]
     ]
    },
    "arguments": {
     "$keys": [
      [
       [
        116
       ],
       {
        "utf16": [
         233,
         20013
        ]
       }
      ]
     ]
    },
    "expect": "reject"
   },
   {
    "id": "pattern-unanchored/ascii/pair",
    "schema": {
     "$keys": [
      [
       [
        116,
        121,
        112,
        101
       ],
       {
        "utf16": [
         111,
         98,
         106,
         101,
         99,
         116
        ]
       }
      ],
      [
       [
        112,
        114,
        111,
        112,
        101,
        114,
        116,
        105,
        101,
        115
       ],
       {
        "$keys": [
         [
          [
           116
          ],
          {
           "$keys": [
            [
             [
              116,
              121,
              112,
              101
             ],
             {
              "utf16": [
               115,
               116,
               114,
               105,
               110,
               103
              ]
             }
            ],
            [
             [
              112,
              97,
              116,
              116,
              101,
              114,
              110
             ],
             {
              "utf16": [
               97,
               98
              ]
             }
            ]
           ]
          }
         ]
        ]
       }
      ]
     ]
    },
    "arguments": {
     "$keys": [
      [
       [
        116
       ],
       {
        "utf16": [
         55357,
         56832
        ]
       }
      ]
     ]
    },
    "expect": "reject"
   },
   {
    "id": "pattern-unanchored/ascii/lone-high",
    "schema": {
     "$keys": [
      [
       [
        116,
        121,
        112,
        101
       ],
       {
        "utf16": [
         111,
         98,
         106,
         101,
         99,
         116
        ]
       }
      ],
      [
       [
        112,
        114,
        111,
        112,
        101,
        114,
        116,
        105,
        101,
        115
       ],
       {
        "$keys": [
         [
          [
           116
          ],
          {
           "$keys": [
            [
             [
              116,
              121,
              112,
              101
             ],
             {
              "utf16": [
               115,
               116,
               114,
               105,
               110,
               103
              ]
             }
            ],
            [
             [
              112,
              97,
              116,
              116,
              101,
              114,
              110
             ],
             {
              "utf16": [
               97,
               98
              ]
             }
            ]
           ]
          }
         ]
        ]
       }
      ]
     ]
    },
    "arguments": {
     "$keys": [
      [
       [
        116
       ],
       {
        "utf16": [
         55296
        ]
       }
      ]
     ]
    },
    "expect": "reject"
   },
   {
    "id": "pattern-unanchored/ascii/lone-low",
    "schema": {
     "$keys": [
      [
       [
        116,
        121,
        112,
        101
       ],
       {
        "utf16": [
         111,
         98,
         106,
         101,
         99,
         116
        ]
       }
      ],
      [
       [
        112,
        114,
        111,
        112,
        101,
        114,
        116,
        105,
        101,
        115
       ],
       {
        "$keys": [
         [
          [
           116
          ],
          {
           "$keys": [
            [
             [
              116,
              121,
              112,
              101
             ],
             {
              "utf16": [
               115,
               116,
               114,
               105,
               110,
               103
              ]
             }
            ],
            [
             [
              112,
              97,
              116,
              116,
              101,
              114,
              110
             ],
             {
              "utf16": [
               97,
               98
              ]
             }
            ]
           ]
          }
         ]
        ]
       }
      ]
     ]
    },
    "arguments": {
     "$keys": [
      [
       [
        116
       ],
       {
        "utf16": [
         56320
        ]
       }
      ]
     ]
    },
    "expect": "reject"
   },
   {
    "id": "pattern-unanchored/ascii/pair-then-lone-high",
    "schema": {
     "$keys": [
      [
       [
        116,
        121,
        112,
        101
       ],
       {
        "utf16": [
         111,
         98,
         106,
         101,
         99,
         116
        ]
       }
      ],
      [
       [
        112,
        114,
        111,
        112,
        101,
        114,
        116,
        105,
        101,
        115
       ],
       {
        "$keys": [
         [
          [
           116
          ],
          {
           "$keys": [
            [
             [
              116,
              121,
              112,
              101
             ],
             {
              "utf16": [
               115,
               116,
               114,
               105,
               110,
               103
              ]
             }
            ],
            [
             [
              112,
              97,
              116,
              116,
              101,
              114,
              110
             ],
             {
              "utf16": [
               97,
               98
              ]
             }
            ]
           ]
          }
         ]
        ]
       }
      ]
     ]
    },
    "arguments": {
     "$keys": [
      [
       [
        116
       ],
       {
        "utf16": [
         55357,
         56832,
         55296
        ]
       }
      ]
     ]
    },
    "expect": "reject"
   },
   {
    "id": "pattern-unanchored/ascii/fffd",
    "schema": {
     "$keys": [
      [
       [
        116,
        121,
        112,
        101
       ],
       {
        "utf16": [
         111,
         98,
         106,
         101,
         99,
         116
        ]
       }